type,year,authors,title,venue
publications,2005,"Charlet Jean, Laublet Philippe, Reynaud Chantal (Dir.)","Le Web Sémantique, Hors série de la revue I3 (Information, Interaction, Intelligence), Volume (4), N°1", Cépadues
publications,2005,"Desclés Jean-Pierre, Guentchéva Zlatka",Applicative and Combinatory Categorial Grammar and Subordinate Constructions in French," nternational Journal on Artificial Intelligence Tools, Vol 14, N°1 &amp; 2, 125-136 2. Desclés Jean-Pierre, Guentchéva Zlatka (2005), ""Doit-on tenir compte de la polysémie verbale en typologie ?"" , Langue française 145, 93-107 3. Freund Michael (2005), ""Revising preferences and choices"" , Journal of Mathematical Economics 41, 229-251 [ ] 4. Gorgatchev Bissera (2005), ""Le present perfect résultatif: marqueurs aspectuels"" , A. Molendijk &amp; Co Vet (Eds.), Temporalité et Attitude, Cahiers Chronos, N°12, Amsterdam/New York : Rodopi, 171-185 5. Jackiewicz Agata (2005), ""Les séries linéaires dans le discours"" , Les adverbiaux cadratifs, Revue Langue française, N°148, 6. Rayon Nadine (2005), ""Analyse morpho-graphémique pour la catégorisation automatique des séquences de kanji dans des textes japonais"" , The Prague Bulletin of Mathematical Linguistics n° 83, Prague, 47-58 7. Zarri Gian Piedro (2005), ""Integrating the Two Main Inference Modes of NKRL, Transformations and Hypotheses"" , Journal on Data Semantics (JoDS), 4, 304-340"
publications,2005,Pognan Patrice,Je znalost historické mluvnice pot&#345;ebná k automatické analýze &#269;eštiny? (La connaissance de la grammaire historique est-elle utile à l’analyse automatique du tchèque ?)," Sborník na po&#269;est, Prof. PhDr. Evy Haji&#269;ové, DrSc., Prague (République tchèque)"
publications,2005,Rayon Nadine,"Forme, conscience et catégorisation linguistique: l'apport de Benveniste"," Écho des études romanes, Vol. I /Num. 2, &#268;eské Bud&#283;jovice: Université de Bohême du Sud, 31-39 2. Rayon Nadine (2005), ""Analyse morpho-graphémique pour l’indexation et la catégorisation automatique des séquences de kanji dans les textes japonais"" , Bulletin du Centre de hautes études internationales d’Informatique Documentaire n° 98, Paris, 1-15"
publications,2005,Bouhafs Hafsia Asma,"Utilisation de la méthode d'exploration contextuelle pour une extraction d'information sur le web dédiées à la veille. Réalisation du système informatique JavaVeille.,","sous la direction de Jean-Pierre Desclés , Université Paris-Sorbonne, 2005-03-11 [ ]"
publications,2005,Christou Sotiroula,"L'emprunt linguistique en grec chypriote,","sous la direction de Amr Helmy Ibrahim , Université de Paris Nord, 2005-06-27"
publications,2005,Farzindar Atefeh,"Résumé automatique de textes juridiques,","sous la direction de Jean-Pierre Desclés , Guy Lapalme , Université Paris-Sorbonne, Université de Montréal, 2005-03-29"
publications,2005,Gauvain Philippe,"Les notions de mouvement et de changement en relation avec les théories contemporaines de l’aspectualité et de la cognition,","sous la direction de Jean-Pierre Desclés , Université Paris-Sorbonne, 2005-06-24 [ ]"
publications,2005,Gwiazdecka Ewa,"Aspects, prépositions et préverbes dans une perspective logique et cognitive. Application au polonais : przez/prze-, do/do-, od/od-,","sous la direction de Banys Wieslaw, Jean-Pierre Desclés , Université de Silésie, Université Paris-Sorbonne, 2005-04-29 [ ][ ]"
publications,2005,Isaac Antoine,"Capture et formalisation des contraintes sémantiques : utilisation pour la conception des ontologies.,","sous la direction de Jean-Pierre Desclés, Philippe Laublet , Université Paris-Sorbonne, 2005-12-08 [ ]"
publications,2005,Suh Jungyeon,"Etude des valeurs aspecto-temporelles du coréen dans un modèle cognitif et formel : -eoss- et -teo-,","sous la direction de Jean-Pierre Desclés , Université Paris-Sorbonne, 2005-02-12"
publications,2005,Werli Stéphanie,"Agent de détection de faits et d’événements majeurs dans les textes de la toile. Une application à la veille : le système ALSEM,","sous la direction de Jean-Pierre Desclés , Université Paris-Sorbonne, 2005-06-27"
publications,2005,,"Dans le contexte des Technologies de l’Information et de la Communication : Une écriture pictographique fondée sur des principes sémantiques,","sous la direction de Jean-Pierre Desclés , Université Paris-Sorbonne, 2005-11-23"
publications,2005,"Amardheil Florence, Laublet Philippe, Minel Jean-Luc",Document Annotation and Ontology Population form Linguistic Extractions," KCap (Third International Conference on Knowledge Capture), Banff, Canada, 2-5 Octobre, 2. Bentolila Fernand (2005), ""La description morphologique du verbe en français"" , Journées d’études Langue, Communication, Informatique, Oujda, 3. Bentolila Fernand (2005), ""Description linguistique et didactique: simplifier pour comprendre et faire comprendre"" , Linguistique berbère: les nouveaux horizons, Tétouan, 4. Bertino, E., Ferrari, E., Perego, A., and Zarri Gian-Pedro (2005), ""An Integrated Approach to Rating and Filtering Web Content"" , Innovations in Applied Artificial Intelligence: 18th International Conference on Industrial and Engineering Applications of Artificial Intelligence and Expert Systems, IEA/AIE 2005 (Lectures Notes in Computer Science 3533), Moonis, A., and Esposito, F., eds. Heidelberg: Springer Verlag., 5. Bertino, E., Ferrari, E., Perego, A., and Zarri, G.P. (2005), ""A Multi-strategy Approach to Rating and Filtering Online Resources"" , Database and Expert Systems Applications - Proceedings of the 16th International Conference, DEXA’05. Los Alamitos (CA): IEEE Computer Society Press., 6. Couto Javier, Lundquist Lita, Minel Jean-Luc (2005), ""Navigation interactive pour l'apprentissage en linguistique textuelle"" , EIAH 2005, Montpellier, 7. Couto Javier; Lundquist Linda; Minel Jean-Luc (2005), ""Using NaviTexte to teach French as a second language"" , Recent Research Developments in Learning Technologies, Carcerès, Espagne, 8. Desclés Jean-Pierre, Djioua Brahim (2005), ""Using Combinatory Logic for a synthesis and an analysis of meaning"" , First World Congress and School on Universal Logic (UNILOG’05), Montreux –Switzerland, march 26th - april 3rd, 9. Desclés Jean-Pierre, Pascu Anca (2005), ""Logic of Determination of Objects : the meaning of variable in quantification"" , Flairs 2005, edited by AAAI Press, Floride, 610-616 [ ] 10. Georgiev N.,Labat Jean-Marc, Minel Jean-Luc, Nicolas L. (2005), ""SUPERVISED DATA EXTRACTION"" , IADIS, WWW/Internet 2005, Lisbonne, 11. Gwiazdecka Ewa (2005), ""La préposition et le préverbe comme opérateurs sur des lieux abstraits"" , Semantic relations in Language and Culture, 24-26 X, Bia&#322;ystok, 115-124 12. Ibrahim Amr Helmy (2005), ""Light verbs in Standard and Egyptian Arabic"" , Perspectives in Arabic Linguistics, Papers from the Annual Symposium on Arabic Linguistics (Proceedings of the 2003 Alexandria 17th Symposium - Mohammad T. Alhawary &amp; Elabbas Benmamoun eds), Amsterdam: John Benjamins Publishing Company, 116-129 13. Ibrahim Amr Helmy (2005), ""Lexicon Grammar within Defining Matrix Analysis Model"" , Human Language Technologies as a Challenge for Computer Science and Linguistics - In memory of Maurice Gross and Antonio Zampoli, Proceedings of the 2nd Language &amp; Technology Conference, Poznan, Poland, 196-200 [ ] 14. Isaac Antoine, Troncy Raphaël (2005), ""Using Several Ontologies for Describing Audiovisual Documents : A Case Study in the Medical Domain."" , Workshop on Multimedia and the Semantic Web, Second European Semantic Web Conference (ESWC 2005), Heraklion, Crete, 15. Kostov Jovan (2005), ""Discours et tendances post-communistes : Macédoine (1990-2004)"" , Journée d’études sur l’éveil des nationalités et les revendications linguistiques, groupe de recherches ARSER, DIPRALANG, Université Paul Valéry, Montpellier, publié in Djordjevic K. Kostov J. &amp; all. , A l’Est du nouveau ?, Paris, L’Harmattan,, 29-44 16. Kostov Jovan (2005), ""Quelle politique pour enseigner et diffuser les langues minoritaires en Macédoine ?"" , Colloque international sur l’école et les langues minoritaires Université de Perpignan, publié in Burban C. &amp; Lagarde C. , L’Ecole, instrument de sauvegarde des langues menacées., Presses Universitaires de Perpignan, 97-107 17. Passant Alexandre, Laublet Philippe, Testard-Vaillant François-Xavier (2005), ""Annotation and Collaborative Work : a Corporate Approach"" , International Workshop « Annotation for Collaboration », Paris, Novembre 2005, 133-142 [ ] 18. Pognan Patrice (2005), ""Informatique et bureautique à l'appui de stratégies pédagogiques pour l'enseignement de langues du Maroc (français, arabe marocain, berbère)"" , Journées d’études Langue, Communication, Informatique, Oujda (Maroc), 19. Taïfi Miloud, Pognan Patrice (2005), ""Langues berbères: à la recherche du système perdu"" , Colloque international « Linguistique amazighe: les nouveaux horizons », Tétouan (Maroc), 20. Zarri Gian Piedro (2005), ""Conceptual Modelling (and Problem Solving Techniques) for Complex Narrative Events"" , Proceedings of the 15th European-Japanese Conference on Information Modelling and Knowledge Bases, Kiyoki, Y., Kangassalo, H., Jaakkola, H., and Henno, J., eds. Tallinn: Tallinn University of Technology Press., 21. Zarri Gian Piedro (2005), ""Semantic/Conceptual Annotations Making Use of the NKRL Technology"" , Proceedings of the International Workshop on Annotation for Collaboration – Methods, Tools and Practices, Boujut, J.-F., ed. Paris: CNRS., 22. Zarri Gian Piedro (2005), ""An n-ary Language for Representing Narrative Information on the Web"" , SWAP 2005, Semantic Web Applications and Perspectives – Proceedings of the 2nd Italian Semantic Web Workshop (CEUR-WS.org/Vol-166), Boquet, P., and Tummarello, G., eds., Aachen: Sun SITE Central Europe (CEUR, http://SunSITE.Informatik.RWTH-Aachen.DE/Publications/CEUR-WS/)"
publications,2005,Battistelli Delphine,Computational linguistics : how to deal with semantics ? The example of temporality processing," VCU (Virginia Commonwealth University), Mathematics (Operational Research) department, Richmond, USA, 2 mars 2005, 2. Ibrahim Amr Helmy (2005), ""L'évolution des expressions figées, semi-figées et à support en arabe égyptien: un cas d'école"" , Methods XII, 12e congrés international international portant sur les méthodes en Dialectologie, Université de Moncton, 1-5 août, 3. Mourad Ghassan (2005), ""Le discours journalistique"" , Université libanaise, Faculté de lettre et des sciences humaines, Beyrouth, Liban., 4. Mourad Ghassan (2005), ""Intérêt du TAL pour la e-formation des langues"" , Université d’Antonine, Beyrouth, Liban"
publications,2005,"Amardeilh Florence, Laublet Philippe, Minel Jean-Luc",Annotation documentaire et peuplement d'ontologie à partir d'extractions linguistiques," 16e journées francophones d'ingénierie des connaissances, Nice, 30 mai-3 juin, 160-172 2. Boudon Pierre (2005), ""La question du trait, quasi-topologie et signification"" , Actes du Colloque Rôle de l’esquisse architecturale dans le monde numérique,, Paris, 173-188 3. Desclés Jean-Pierre, Pascu Anca (2005), ""Le temps dans les textes mathématiques"" , Nouvelles journées de l'ERLA N° 6 Le temps dans le texte de spécialité, Brest, novembre, 4. Garron Isabelle, Minel Jean-Luc, Souchier Emmanuël (2005), ""Index ou citation? De la circulation et de la lecture des textes relatifs à une œuvre sur internet: le cas de Raymond Queneau"" , Colloque Indice, Index, Indexation, Colloque organisé par CERSATES, UMR-CNRS 8529 (Equipe anthropologie des savoirs) et GERICO., Université Charles de Gaulle - Lille3, Lille, 3 -4 novembre, 5. Isaac Antoine, Bachimont Bruno, Laublet Philippe (2005), ""Indexation de documents AV : Ontologies, patrons de conception et d’utilisation"" , IC 2005 (Ingénierie des connaissances), Nice, Juin 2005, 6. Isaac Antoine, Troncy Raphaël (2005), ""Ontologies et description du contenu de documents audiovisuels : une expérimentation dans le domaine médical."" , Atelier Connaissance et Document Temporel, 16ièmes Journées Francophones d'Ingénierie des Connaissances (IC'2005), Nice, France, 7. Talbi Nacima, Laublet Philippe (2005), ""Construction d'un modèle générique d'expertise à partir d'un exemple : une solution pragmatique"" , 6° Journées Francophones d'Acquisition des Connaissances, Grenoble, Avril 1995"
publications,2005,,Je znalost historické mluvnice pot&#345;ebná k automatické analýze &#269;eštiny? (La connaissance de la grammaire historique est-elle utile à l’analyse automatique du tchèque ?)," Sborník na po&#269;est Prof. PhDr. Evy Haji&#269;ové, DrSc, Prague (République tchèque)"
publications,2005,"Desclés Jean-Pierre, Djioua Brahim, Le Kien Van Carine, Le Priol Florence",LOGIC : aide animée et interactive pour l'apprentissage de la logique des propositions et des prédicats selon la méthode de déduction naturelle," Cahiers LaLICC n°2005/01, version 1, 10 mars 2005 [ ]"
publications,2006,"Battistelli Delphine, Minel  Jean-Luc",Compréhension des langues et interaction," Eds. G. Sabah, Hermès, 295-330 2. Boudon Pierre (2006), L’articulation des noms propres, ""Antoine Culioli, un Homme dans le langage "" , Paris Ophrys, 70-86 3. Charlet Jean , Laublet Philippe , Reynaud Chantal (2006), Web Sémantique, ""Encyclopédie des systèmes d’information, chapitre, section Intelligence Artificielle "" , Eds. Daniel Kayser (responsable), Vuibert, 4. Desclés Jean-Pierre (2006), Opérations métalinguistiques et traces linguistiques, ""Antoine Culioli, un Homme dans la langue "" , Ophrys, Paris, 41-69 5. Ibrahim Amr Helmy (2006), De la synonymie à la traduction ou comment améliorer les dictionnaires bilingues arabes, ""Le français dans les dictionnaires bilingues "" , Paris: Honoré Champion, 173-188 6. Laublet Philippe, Charlet Jean , Reynaud Chantal (2006), Sur des aspects primordiaux du Web Sémantique, ""La redocumentarisation du monde "" , Cépadues, 7. Merkoulova Inna (2006), La catégorie du temps contracté d’un point de vue sémiotique, ""Régimes sémiotiques de la temporalité. La flèche brisée du temps "" , Paris, PUF, 425-443 8. Zarri Gian Piedro (2006), Représentation et traitement avancé de documents narratifs complexes au moyen du Narrative Knowledge Representation Language (NKRL), ""“Le Storytelling. Concepts, outils et applications "" , Eds. Soulier, E., dir., Paris: Hermès/Lavoisier"
publications,2006,"Nolan, Lemay","Le Slovaque de poche, adaptation française", Eds. ASSIMIL
publications,2006,,Référentiels et ordonnancements temporels dans les textes," Information temporelle, procédures et ordre discursif. Cahiers Chronos, vol. 18, Rodopi, Amsterdam, 24 pages 2. Battistelli Delphine, Minel Jean-Luc, Schwer Sylviane (2006), ""Représentation des expressions calendaires dans les textes : vers une application à la lecture assistée de biographies"" , TAL, Vol. 47/2, 11-37 3. Biskri Ismaïl, Desclés Jean-Pierre (2006), ""Coordination de catégories différentes en français"" , Faits de Langues, Ophrys, 57-66 4. Biskri Ismaïl, Desclés Jean-Pierre, Boucif Amar Bensaber (2006), ""Coordination and Applicative Categorial Type Logic"" , Artificial Intelligence Tools, Architectures, Languages, Algorithms, Vol 15, N°6, 1007-1019 5. Desclés Jean-Pierre, Kye-Seop Cheong, (2006), ""Analyse critique de la notion de variable : points de vue sémiotique et formel 2"" , Mathématiques et sciences humaines, 69-99 6. Desclés Jean-Pierre, Pascu Anca (2006), ""Logic of Determination of Objects :The Meaning of Variable in Quantification"" , International Journal on Artificial Intelligence Tools, Vol 15, N° 6, 1041-1052 7. Guibert Gaell (2006), ""Application d'une méthode de linguistique textuelle au livre de Ruth"" , Semiotica 158, 85-146"
publications,2006,"Desclés Jean-Pierre, Jackiewicz Agata",Enrichissement de bases de connaissances par l'annotation sémantique," Ingénierie des Systèmes d'Information (ISI), Edition spéciale ""Systèmes d'information stratégiques"", Vol.11(2), Editions Hermès, 53-70 2. Desclés Jean-Pierre, Jackiewicz Agata (2006), ""Abduction et prise en charge de la causalité"" , La cause : approche pluridisciplinaire, revue LINX, N° 54, , 3. Desclés Jean-Pierre, Kye-Seop Cheong, (2006), ""Analyse critique de la notion de variable : points de vue sémiotique et formel"" , Mathématiques et sciences humaines, , 43-102"
publications,2006,,Quels présupposés des méthodes de traduction et d’analyse des textes bibliques ?," Sémiotique appliquée 18, "
publications,2006,Ahnaïba Adel,"Les verbes supports en arabe classique, arabe moderne et arabe libyen: le cas de 'akhadha / ittakhadha (prendre),","sous la direction de Amr Helmy Ibrahim , Université Paris-Sorbonne, 2006-06-26"
publications,2006,Chagnoux Marie,"Temporalité et aspectualité dans les textes français : modélisation sémantico-cognitive et traitement informatique,","sous la direction de Jean-Pierre Desclés , Université Paris-Sorbonne, 2006-11-23"
publications,2006,Couto Javier,"Une plate-forme informatique de Navigation Textuelle : modélisation, architecture, réalisation et applications de NaviTexte,","sous la direction de Jean-Luc Minel , Université Paris-Sorbonne, 2006-07-10 [ ]"
publications,2006,Park Wonsil,"Sémantique et représentation formelle de verbes qui expriment les relations causales : augmenter, conduire, créer, déclencher, diminuer, entraîner, entretenir, pousser, provoquer.,","sous la direction de Jean-Pierre Desclés , Université Paris-Sorbonne, 2006-01-18"
publications,2006,Regragui Souad,"Les mots et les femmes. Sémantique et symbolique du vocabulaire descriptif de la femme en arabe marocain.,","sous la direction de M. Taïfi et P. Pognan , Université Sidi Mohamed ben Abdellah de Fès, 2006-06-00"
publications,2006,Roche Virginie,"Analyse du discours sur la musique des jeunes en france et en allemagne,","sous la direction de Amr Helmy Ibrahim , Université de Franche-Comté, 2006-12-21"
publications,2006,Son Hogun,"Représentation sémantico-cognitive des verbes de transfert :,","sous la direction de Jean-Pierre Desclés , Université Paris-Sorbonne, 2006-12-09"
publications,2006,Van Den Handel Marina,"Temps verbaux en grec et en français : analyse sémantique et problèmes de traduction de l'aoriste du parfait et de l'imparfait,","sous la direction de Jean-Pierre Desclés , Université Paris-Sorbonne, 2006-03-17"
publications,2006,,"Les objets dans la représentation des connaissances. Application aux processus de catégorisation et dans les sciences humaines.,","sous la direction de Jean-Pierre Desclés , Université Paris-Sorbonne, 2006-12-02 [ ]"
publications,2006,Abraham Maryvonne,L’Interprète de poche ou les problèmes d’un machine à traduire universelle," GLAT 2006 : Aspects méthodologiques pour l'élaboration de lexiques unilingues et multilingues, Bertinoro, Italie, 17-20 mai, 209-220 2. Abraham Maryvonne (2006), ""Altération de la communication dialogique : le statut de la langue dans la palliation des troubles de la parole"" , Handicap 2006 : 4ème conférence Nouvelles technologies au service de l'homme, Paris, France, 8-9 juin, 3. Alrahabi Motasem ,Ibrahim Amr Helmy , Desclés Jean-Pierre (2006), ""Semantic Annotation of Reported Information in Arabic"" , FLAIRS 2006, Melbourne, Floride, 11-13 mai, 263-268 [ ] 4. Alrahabi Motasem, Djioua Brahim, Desclés Jean-Pierre (2006), ""Annotation Sémantique des Énonciations en Arabe"" , INFORSID 2006, Hammamet –Tunisie, 31 mai 2006, [ ] 5. Amardeilh Florence (2006), ""OntoPop or how to annotate documents and populate ontologies from texts"" , Proceedings of the ESWC 2006 Workshop on Mastering the Gap: From Information Extraction to Semantic Representation, CEUR Workshop Proceedings, ISSN 1613-0073, Budva, Montenegro, 12 juin, 6. Amardeilh Florence, Carloni Olivier, Noel Laurence (2006), ""PressIndex: a Semantic Web Press Clipping Application"" , Proceedings of the ISWC 2006 Semantic Web Challenge, Athens, Georgia, USA, 5-9 novembre, 7. Bentolila Fernand (2006), ""L’adverbe en tamazight"" , Linguistique descriptive et didactique de l'amazigh,, Agadir, 8. Bertin Marc, Desclés Jean-Pierre, Djioua Brahim,Krushkov Yordan (2006), ""Automatic Annotation in Text for Bibliometrics Use"" , FLAIRS 2006, Melbourne, Floride, 11-13 mai, 313-316 [ ] [ ] 9. Bertin Marc, Desclés Jean-Pierre, Djioua Brahim,Krushkov Yordan (2006), ""Bibliométrie et linguistique : Évaluation de la production scientifique et annotation sémantique"" , CiDE.9, Friboug, 18-22 septembre, 10. Bertin Marc, Desclés Jean-Pierre, Krushkov Yordan (2006), ""Critique de la bibliométrie comme outil d'évaluation; vers une approche qualitative."" , Digital Humanities 2006, Paris, 5-9 juillet, 15-17 [ ] 11. Blais Antoine , Desclés Jean-Pierre , Djioua Brahim (2006), ""Le résumé automatique dans la plate-forme EXCOM"" , Digital Humanities 2006, Paris, 5-9 juillet, 31-33 [ ] 12. Boudon Pierre (2006), ""Totalisation et quantification discursive"" , Actes du Colloque La relation Partie-Tout, sous la direction de G. Kleiber, C. Schnedeker et A. Theissen, Louvain-Paris, éd. Peeter, 735-749 13. Desclés Jean-Pierre (2006), ""Contextual Exploration Processing for Discourse Automatic Annotations of Texts"" , FLAIRS 2006, Melbourne, Floride, 11-13 mai, Invited Speakers, 281-284 [ ] 14. Djioua Brahim , Jorge Garcia Flores, Antoine Blais, Jean Pierre Desclés, Guibert Gael, Agata Jackiewicz, Florence Le Priol, Nait-Baha Leila, Benoît Sauzay (2006), ""EXCOM: an automatic annotation engine for semantic information"" , FLAIRS 2006, Melbourne, Floride, 11-13 mai, 285-290 [ ] 15. Galitsky Boris, Pascu Anca (2006), ""Epistemic Categorization for Analysis of Customer Complaints"" , Proceedings of the Nineteenth International Florida Artificial Intelligence Research Society Conference, FLAIRS 2006, 291-297 [ ] 16. García-Flores Jorge, Ivanova Elena, Djioua Brahim, Desclés Jean-Pierre (2006), ""Annotation automatique des relations de contrôle dans des spécification de besoins informatiques"" , Traitement Automatique du Langage Naturel 2006 (TALN06), Presses Universitaires de Louvain, Louvain, Belgique, 10-13 Avril, [ ] 17. Gorgatchev Bissera (2006), ""The Bulgarian Perfect : an Aspectual study"" , Proceedings from FASSBL ,5 : International Conference on FASSBL, Sofia, 18-20 octobre, 18. Ibrahim Amr Helmy (2006), ""1798-1976 Le français référentiaire des élites égyptiennes"" , Colloque International, Le Français langue des élites, (SIHFLES), Istamboul – Univ. Galata Saray, 7-9 novembre, 19. Kubo&#328;, Lopatková, Plátek, Pognan Patrice (2006), ""Segmentation of Complex Sentences"" , TSD (Text, Speech and Dialogue), Brno (République tchèque), 20. Kubo&#328;, Lopatková, Plátek, Pognan Patrice (2006), ""O segmentaci &#269;eských v&#283;t (A propos de la segmentation des phrases tchèques)"" , ITAT, Bratislava / Košice (Slovaquie), 21. Le Priol Florence , Blais Antoine, Desclés Jean-Pierre, Djioua Brahim, Garcia-Flores Jorge, Guibert Gaëll, Jackiewicz Agata, Nait-Baha Leila, Sauzay Benoît (2006), ""Automatic annotation of localization and identification relations in platform EXCOM"" , FLAIRS 2006, Melbourne, Floride, 11-13 mai, 307-312 [ ] [ ] 22. Le Priol Florence, Desclés Jean-Pierre, Djioua Brahim, Carine Le Kien Van (2006), ""LOGIC, un outil en ligne, dynamique et interactif aux services de l'enseignement de la logique aux apprenants des disciplines d'humanités"" , TICE 2006, Toulouse, 25-27 octobre, 23. Le Priol Florence, Desclés Jean-Pierre, Djioua Brahim, Le Kien Van Carine (2006), ""Communication and information technologies used for logic teaching to the disciplines of humanities students : LOGIC, an on line tool, dynamics and interactive"" , Digital Humanities 2006, Paris, 5-9 juillet, 121-125 [ ] [ ] 24. Passant Alexandre, Sta Jean-David, Laublet Philippe (2006), ""Adopting Folksonomies in a corporate context"" , Conférence Blogtalk Reloaded, Vienne, Octobre 2006, 25. Pognan Patrice (2006), ""Apprendre le tamazight dans une approche linguistique plurielle"" , Colloque Linguistique descriptive et didactique de l’amazigh, Agadir (Maroc), 26. Seddah Djamé, Sagot Benoît (2006), ""Modélisation et analyse des coordinations elliptiques via l'exploitation dynamique des forêts de dérivation"" , Traitement automatique des Langues Naturelles 2006 (TALN06), Louvain, Belgique, 27. Vinzerich Aude (2006), ""Référentiel des possibles : représentation de situations potentielles et irréelles"" , Chronos 7, Temps verbaux et modalit, Anvers, Belgique, 18-20 septembre, 28. Zarri Gian Piedro (2006), ""Modeling and Advanced Exploitation of eChronicle ‘Narrative’ Information"" , Proceedings of the 22nd International Conference on Data Engineering Workshops – ICDE Workshop on eChronicles (ICDEW’06), IEEE Computer Society Press., Los Alamitos (CA)"
