type,year,authors,title,venue
publications,2008,,Jonas ou la volonté de dialoguer," Sémiotique et Bible, N°126 et 127, , 34-63 et 40-67 2. Merkoulova Inna (2008), ""Une vieille idée russe renouvelée en France : polyphonie et dialogue des cultures"" , numéro spécial Revue russe, à paraître, Association française des russisants - Institut d’études slaves, Paris, 3. Merkoulova Inna (2008), ""L’avant-garde fantastique de Sigismund Krzyzanovski"" , Kitch et avant-garde, numéro spécial Prothée, Québec"
publications,2008,Blais Antoine,"Résumé automatique de textes scientifiques et construction de fiches de synthèse catégorisées : Approche linguistique par annotations sémantiques et réalisation informatique,","sous la direction de Jean-Pierre Desclés , Université Paris-Sorbonne, 2008-06-25 [ ]"
publications,2008,Daynovska Denitsa,"Analyse de quelques préverbes et prépositions français et bulgares dans une perspective cognitive et formelle,","sous la direction de Jean-Pierre Desclés , Université de Paris–Sorbonne et Université de Sofia «St. Clément d’Ohrid», 2008-06-09 [ ]"
publications,2008,Šmilauer Ivan,"Acquisition du tchèque par les francophones : analyse automatique des erreurs de déclinaison,","sous la direction de Eva Haji&#269;ová et Patrice Pognan , Université Charles de Prague, lnstitut National des Langues et Civilisations Orientales (INALCO), 2008-11-29 [ ]"
publications,2008,,"Vers une nouvelle théorie de la pertinence et de ses origines cognitives,","sous la direction de Jean-Pierre Desclés , Université Paris-Sorbonne, 2008-06-16"
publications,2008,"Alrahabi Motasem , Desclés Jean-Pierre","Automatic annotation of direct reported speech in Arabic and French, according to semantic map of enunciative modalities"," 6th International Conference on Natural Language Processing, GoTAL, Gothenburg, Sweden, August 25-27, 41-51 [ ] 2. Atanassova Iana, Blais Antoine, Desclés Jean-Pierre (2008), ""A Cross-lingual Approach to the Discourse Automatic Annotation : Application to French and Bulgarian"" , FLAIRS-21 (21th International Florida Artificial Intelligence Research Society Conference), Miami, Florida, 15-17 may, 450-455 [ ] [ ] 3. Atanassova Iana, Desclés Jean-Pierre, Franchi Aurélien, Le Priol Florence (2008), ""La plate-forme EXCOM comme outil automatique d'annotations sémantiques des textes pour la catégorisation d'informations sur le Web"" , Colloque ""Internet : besoin de communiquer autrement"", Université St. Clément d'Ohride, Sofia, Bulgarie, 25-26 octobre, [ ] [ ] 4. Battistelli Delphine, Couto Javier, Minel Jean-Luc, Schwer Sylviane (2008), ""Representing and visualizing calendar expressions in texts"" , Actes STEP’08 (Symposium on Semantics in Systems for Text Processing), Venise, 22-24 septembre 2008, 10 pages 5. Battistelli Delphine, Couto Javier, Minel Jean-Luc, Schwer Sylviane (2008), ""Représentation algébrique des expressions calendaires et vue calendaire d’un texte"" , TALN’08 (Traitement automatique du langage naturel 2008), Avignon, 8-12 juin, 10 pages 6. Bertin Marc (2008), ""Categorizations and annotations of Citation in Research Evaluation"" , FLAIRS-21 (21th International Florida Artificial Intelligence Research Society Conference), Miami, Florida, 15-17 may, 456-461 [ ] 7. Desclés Jean-Pierre (2008), ""Towards a Bridge between Cognitive Linguistics and Formal Ontology"" , keynote talk, in Proceedings of the Twenty First International FLAIRS Conference, Coconut Grove, Florida,, 15-17 may, 18-20 8. Elkhlifi Aymen et Faïz Rim (2008), ""AnnotEv : Système d’annotation des événements"" , Actes des huitièmes journées scientifiques des jeunes chercheurs en Génie Electronique et Informatique (GEI 2008) session spéciale Web Sémantique, Sousse, Tunisie, 173-182 9. Gwiazdecka Ewa (2008), ""L’achèvement comme catégorie aspectuelle en polonais et en français"" , Studia Romanica Tartuensia, Tartu, Estonia, 10. Ibrahim Amr Helmy (2008), ""A text-book case for Arabic dialects typology: the evolution of expressive structures in Egyptian Arabic"" , Arabic dialects classifications: cues and models, Current issues in Linguistic theories, Amsterdam: Benjamin, 11. Kang Juyeon, Desclés Jean-Pierre (2008), ""Korean Parsing Based on Applicative Combinatory Categorial Grammar"" , The 22nd Pacific Asia Conference On Language, Informatics and Computation,, Cebu City, Philippines, 20-22 november, 10p [ ] 12. Kang juyeon, Desclés Jean-Pierre (2008), ""Categorial Grammar, Combinatory Logic and the Korean Language Processing"" , FLAIRS-21 (21th International Florida Artificial Intelligence Research Society Conference), Miami, Florida, 15-17 may, [ ] 13. Le Priol Florence (2008), ""Automatic annotation of images, pictures or videos comments for text mining guided by no textual data"" , FLAIRS-21 (21th International Florida Artificial Intelligence Research Society Conference), Miami, Florida, 15-17 may, 494-499 [ ] 14. Merkoulova Inna (2008), ""Pour une rhétorique de la graphie dans les messages artistiques"" , Figures de la figure, Actes du colloque Sémiotique et Rhétorique générale, Urbino, dir. S. Badir et J.-M. Klinkenberg. Limoges, Pulim, 2002, 203-214 15. Pascu Anca, Desclés Jean-Pierre (2008), ""Attribute-Value Formalization in the Framework of the Logic of Determination of Objects"" , Proceedings of the Twenty First International FLAIRS Conference, Florida, 15-17 May, 506-512 [ ] 16. Passant Alexandre, Laublet Philippe (2008), ""Towards an Interlinked Semantic Wiki Farm"" , 3rd Semantic Wiki Workshop co-located with the 5th European Semantic Web Conference (ESWC) http://www.eswc2008.org , Tenerife, Spain, June 02, 17. Passant Alexandre, Laublet Philippe (2008), ""Meaning Of A Tag: A collaborative approach to bridge the gap between tagging and Linked Data"" , Linked Data on The Web (LDOW2008), Workshop, WWW2008, Pékin, April, 18. Passant Alexandre, Laublet Philippe (2008), ""Combining Structure and Semantics for Ontology-based Corporate Wikis"" , 11th International Conference on Business Information Systems, BIS 2008, Innsbruck, Austria, 5-7 May, 19. Pognan Patrice (2008), ""Le système linguistique global pour l’enseignement d’une langue individuelle ou du groupe de langues"" , Didactique de l’intercompréhension (8-13 ans) - multilinguisme et apports cognitifs à l’école, Congrès européen Euro-mania, Toulouse, 20. Rossi Aurélie (2008), ""Applicative and combinatory categorial grammar : analysis of the french interrogative sentences"" , FLAIRS-21 (21th International Florida Artificial Intelligence Research Society Conference), Miami, Florida, 15-17 may, 512-517 21. Seddah Djamé (2008), ""Processing of Elliptic Coordination using Multi Component TAG"" , The Ninth International Workshop on Tree Adjoining Grammars and Related Formalisms, Tuebingen, Allemagne, Juin, 22. Seddah Djamé (2008), ""Coordination and Control processing using Multi-Component TAG grammar: is this realistic?"" , 2nd NaTAL Workshop, Nancy, France, 24 juin, 23. Taïfi Miloud, Pognan Patrice (2008), ""Dualité toponymique au Maroc: projet de répertorisation et description linguistique"" , Primer Col-loqui Internacional sobre la Toponimia Amaziga (Premier colloque international de typonymie berbère), Barcelone (Espagne), 24. Teisseidre Charles, Djioua Brahim, Desclés Jean-Pierre (2008), ""Automatic Retrieval of Definitions in Texts, in Accordance with a General Linguistic Ontology"" , FLAIRS-21 (21th International Florida Artificial Intelligence, Research Society Conference), Miami, Florida, 15-17 may, 518-523 25. Weiser Stéphanie, Laublet Philippe, Minel Jean-Luc (2008), ""Automatic identification of temporal information in tourism web pages"" , LREC 2008, Marrakech, May"
publications,2008,Elkhlifi Aymen et Faïz Rim,"Analyse sémantique des temps, aspects, modalités (TAM) par des représentations topologiques"," 8ième colloque internationale de linguistique, Séoul, août, 2. Desclés Jean-Pierre, Pascu Anca (2008), ""Logic of Determination of Object an Gallois correspondences"" , 39th Meeting of the European Mathematical Psychology Group (EMPG), Vienne, octobre, [ ] 3. Desclés Jean-Pierre, Vinzerich Aude (2008), ""Modélisation topologique des modalités"" , 18ième colloque internationale de linguistique, Séoul, août, 4. Elkhlifi Aymen et Faïz Rim (2008), ""Approche Hybride pour le traitement automatique de la langue"" , Journées scientifiques en Informatique appliquée à la langue, Hammamet, Tunisie, 13-14 février, 5. Guibert Gaell (2008), ""Quels éléments structurels repérer dans un texte? aspects théoriques, méthodologiques et application sur le texte de la Constitution Européenne de 2004 (chapitre 1)"" , Colloque nouvelles approches en linguistique textuelle, Bruxelles, 22-24 mai, 6. Lagji Klara, Le Priol Florence (2008), ""Ndarja automatike e teksteve në gjuhën shqipe në kuadrin e Excom2 (Segmentation automatique de textes en langue albanaise dans le cadre d'Excom2)"" , 2e séminaire International de l'Albanologie : Les études albanologiques dans le nouveau millénaire, Albanie, Université d'Etat de Tetovo, 22-28 septembre, 7. Mourad Ghassan (2008), ""Segmentation et étiquetage de textes par la méthode d’exploration contextuelle"" , Lyon, 3-6 mars"
publications,2008,Le Priol Florence,Sémiotique et Architecture : quel apport offre cette discipline à une science du projet ?," numéro spécial en ligne des Nouveaux Actes Sémiotique, Limoges, 7 pages 2. Kostov Jovan (2008), ""L’Aspect du verbe macédonien"" , Colloque SLAV, Lille, Université de Lille 3, 3. Le Priol Florence (2008), ""Un outil de filtrage automatique des images et de leurs commentaires"" , Les Nouvelles Journées de l'ERLA n°9, ""L'image dans le texte scientifique"", Université de Bretagne Occidentale, Brest, 21-22 novembre 2008, [ ] 4. Passant Alexandre, Laublet Philippe (2008), ""Ontologies et Web 2.0"" , 19e Journées Francophones d’Ingénierie des Connaissances (IC2008), Nancy, Juin"
publications,2008,,Présentation du programme de la GAC dans une approche interdisciplinaire," invitation comme Grand Témoins, Groupe d’interdisciplinarité, Paris"
publications,2009,Abraham Maryvonne,Annotations automatiques et recherche d'informations," Eds. dir. Desclés Jean-Pierre, Le Priol Florence, Hermes - Traite IC2 -- serie Cognition et Traitement de l'information, 2. Alrahabi Motasem (2009), Désambiguïser par le contexte : le cas de la graphie alef-noun, ""Annotations automatiques et recherche d'informations "" , Eds. dir. Desclés Jean-Pierre, Le Priol Florence, Hermes - Traite IC2 -- serie Cognition et Traitement de l'information, 3. Alrahabi Motasem, Desclés Jean-Pierre (2009), Opérations de prise en charge énonciative : assertion, médiatif et modalités dans le discours rapporté direct, en arabe et en français, ""Methods of lexical analysis, theoretical assumptions and practical applications "" , Eds. Bogacki, K., Cholewa, J., Rozumko, A., Wydawnictwo Uniwersytetu w Bialymstoku, 4. Battistelli Delphine (2009), Filtrage sémantique et temporalité linguistique, ""Filtrage sémantique, De l'annotation à la navigation textuelle "" , Eds. J.-L. Minel, Hermès, 67-108 5. Daynovska Denitsa, Gwiazdecka Ewa (2009), Wynie&#347;&#263;/wynosi&#263;, iznesa/iznasjam, odnie&#347;&#263;/odnosi&#263;, otnesa/otnasjam ou comment quitter un lieu abstrait, ""Methods of lexical analysis, theoretical assumptions and practical applications "" , Eds. Bogacki, K., Cholewa, J., Rozumko, A., Bia&#322;ystok, 103-112 [ ] 6. Daynovska, Denitsa (2009), Représentations topologiques pour la description des prépositions: l’exemple de dans en français, ""Des mots et du texte aux conceptions de la description linguistique "" , Eds. Université de Varsovie, à paraitre, 7. Desclés Jean-Pierre, Djioua Brahim (2009), La recherche d'information par accès aux contenus sémantiques, ""Annotations automatiques et recherche d'informations "" , Eds. dir. Desclés Jean-Pierre, Le Priol Florence, Hermes - Traite IC2 -- serie Cognition et Traitement de l'information, 8. Faïz Rim et Elkhlifi Aymen (2009), Annotation sémantique des événements, ""Annotations automatiques et recherche d'informations "" , Eds. dir. Desclés Jean-Pierre, Le Priol Florence, Hermes - Traite IC2 -- serie Cognition et Traitement de l'information, 9. Gwiazdecka Ewa (2009), L'organisation du lexique pour l'extraction automatique des événements saillants de la presse sur le Web, ""Methods of lexical analysis, theoretical assumptions and practical applications "" , Eds. Bogacki, K., Cholewa, J., Rozumko, A., Bia&#322;ystok, 155-164 [ ] 10. Jouannaux, Pognan (2009), ""Frazeologický slovník &#269;eštiny / Dictionnaire phraséologique du tchèque "" , Eds. F. &#268;ermák, Leda, Prague (République tchèque), 11. Laublet Philippe (2009), The semantic web and ontologies, Chapter 13, ""Digital Cognitive Technologies Epistemology and Knowledge Society "" , Eds. Bernard Reber, France Claire Brossaud, ISTE, Wiley, 12. Le Priol Florence, Bertin Marc, Blais Antoine (2009), Annotation et indexation discursives, quelques réalisations, ""Annotations automatiques et recherche d'informations "" , Eds. dir. Desclés Jean-Pierre, Le Priol Florence, Hermes - Traite IC2 -- serie Cognition et Traitement de l'information, 13. Mourad Ghassan (2009), ""La sémantique des signes de ponctuation et leur traitement automatique "" , Beyrouth, Liban, à paraître 14. Zarri Gian Piedro (2009), ""Representation and Management of Narrative Information: Theoretical Principles and Implementation "" , (Series: Advanced Information and Knowledge Processing ), London: Springer, à paraître"
publications,2009,"Desclés Jean-Pierre, Le Priol Florence (Dir.)",Annotations automatiques et recherche d'informations," Hermes - Traite IC2 -- serie Cognition et Traitement de l'information, [ ]"
publications,2009,"Alrahabi Motasem, Desclés Jean-Pierre","Opérations de prise en charge énonciative : assertion, médiatif et modalités dans le discours rapporté direct, en arabe et en français"," Methods of lexical analysis, theoretical assumptions and practical applications, Bogacki, K., Cholewa, J., Rozumko, A. eds., Bialystok: Wydawnictwo Uniwersytetu w Bialymstoku, [ ] 2. Elkhlifi Aymen et Faiz Rim (2009), ""Automatic Annotation Approach of Events"" , News Articles. International Journal of Computing &amp; Information Sciences (IJCIS), à paraitre, 3. Freund Michael (2009), ""On the notion of concept II"" , Artificial Intelligence, à paraître 4. Gwiazdecka Ewa (2009), ""Quelle description pour le préverbe polonais ?"" , Cognitive Studies/ Études Cognitives 9, SOW Publishing House, Warsaw, 243-255 [ ] 5. Passant Alexandre, Laublet Philippe, Breslin John G., Decker Stefan (2009), ""An URI is worth a thousand tags: From tagging to Linked Data with MOAT"" , International Journal of Semantic Web and Information Systems (JSWIS), 5(3), 71-94 6. Provôt Agnès (2009), ""Le ""futur dans le passé"" en français et en allemand : concurrence des formes wird, werde et würde en allemand et comparaison avec le conditionnel français"" , Revue de Sémantique et Pragmatique, n° 25, 205-222 [ ]"
publications,2009,Boizou Loïc,"Analyse lexicale automatique du lithuanien,","sous la direction de Patrice Pognan , Université Paris-Sorbonne, 2009-07-01"
publications,2009,Chai Hyunzoo,"Problèmes de l’Annotation Sémantique Automatique Multilingue - une étude de cas : les relations de localisation en Coréen par la méthode d’Exploration Contextuelle,","sous la direction de Jean-Pierre Desclés , Université Paris-Sorbonne, 2009-07-09"
publications,2009,Ivanova-Tarasova Elena,"Approche cognitive et formelle de la polysémie verbale : les verbes de transfert en français et en russe (comparaison et différences),","sous la direction de Jean-Pierre Desclés , Université Paris-Sorbonne, 2009-02-07 [ ]"
publications,2009,Passant Alexandre,"Technologies du Web Sémantique pour l'Entreprise 2.0,","sous la direction de Jean-Pierre Desclés (Directeur), Philippe Laublet (Co-directeur) , Université Paris-Sorbonne, 2009-06-09"
publications,2009,,"La temporalité linguistique : circonscrire un objet d’analyse ainsi que des finalités à cette analyse,","sous la direction de , Université Paris 10, 2009-11-23"
publications,2009,Abraham Maryvonne,Are ontologies involved in natural language processing ?," FLAIRS-22 (22nd International Florida Artificial Intelligence, Research Society Conference), Sanibel Island, Florida, 19-21 mai, [ ] 2. Alrahabi Motasem, Desclés Jean-Pierre (2009), ""EXCOM : Plate-forme d'annotation se&#769;mantique de textes multilingues"" , TALN 2009, Senlis, 24-26 juin 2009, [ ] 3. Battistelli Delphine, Antonietta Folino, Patricia Geretto, Ludivine Kuznik, Jean-Luc Minel, Florence Amardeilh (2009), ""“Confortation”: about a new qualitative category for analyzing biomedical texts"" , Actes Workshop ISWC’2009 Semantic Web Applications in Scientific Discourse, Washington, USA, 25-29 October 2009, 4. Battistelli Delphine, Florence Amardeilh (2009), ""Knowledge Claims in Scientific Literature, Uncertainty and Semantic Annotation: A Case Study in the Biological Domain"" , Actes Semantic Authoring, Annotation and Knowledge Markup workshop (SAAKM’09), Redondo Beach, California, USA, 1-4 octobre 2009, 10 pages 5. Bertin Marc, Atanassova Iana, Descles Jean-Pierre (2009), ""Automatic Analysis of Author Judgment in Scientific Articles Based on Semantic Annotation"" , FLAIRS-22 (22nd International Florida Artificial Intelligence, Research Society Conference), Sanibel Island, Florida, 19-21 mai, [ ] [ ] 6. Bertin Marc, Atanassova Iana, Desclés Jean-Pierre (2009), ""Extraction of Authors' Definitions Using Indexed Reference Identification"" , RANLP-2009, First Workshop on Definition Extraction, Borovetz, Bulgarie, 18 septembre 2009, [ ] [ ] 7. Desclés Jean-Pierre, Arena Aurélien (2009), ""Toward a formal ontology of time and aspect"" , FLAIRS-22 (22nd International Florida Artificial Intelligence, Research Society Conference), Sanibel Island, Florida, 19-21 mai, [ ] 8. Desclés Julien, Alrahabi Motasem, Desclés Jean-Pierre (2009), ""BioExcom: Automatic Annotation and categorization of speculative sentences in biological literature by a Contextual Exploration processing"" , 4th Language &amp; Technology Conference, Pozna&#324;, Poland, [ ] 9. Desclés Julien, Alrahabi Motasem, Desclés Jean-Pierre, Blais Antoine (2009), ""Automatic Annotation by BioExcom for categoriz-ing prior and new speculations in biological papers"" , Proceedings of The 3rd International Symposium on Languages in Biology and Medicine (LBM), Jeju Island, South Korea, November 8-10, 10. Gwiazdecka Ewa (2009), ""Annotation of Terminology from Protocols in Polish Controlled Language"" , Proceedings of International Symposium on Data and Sens Mining, Machine Translations and Controlled Languages, Bulag, Centre Tesnière, Besançon, July 1-3, 2009, 121-126 11. Le Priol Florence, Diego Pacheco Cristina, Jambou Louis (2009), ""Les techniques informatiques au service des connaissances musicales de la renaissance"" , Digital Humanities 2009, University of Mariland, 22-25 june, [ ] 12. Passant Alexandre, Laublet Philippe, Breslin John et Decker Stefan (2009), ""Semantic Search for Enterprise 2.0"" , Proceedings of the Semantic Search 2009 (SemSearch2009) Workshop at 18th World Wide Web conference (WWW2009), Madrid, Spain, 04/2009, 13. Passant Alexandre, Laublet Philippe, Breslin John, et Decker Stefan (2009), ""SemSLATES: Improving Enterprise 2.0 Information Systems thanks to Semantic Web Technologies"" , The 5th International Conference on Collaborative Computing, Networking, Applications and Worksharing , CollaborateCom, Washington, USA, November 2009, 14. Pognan Patrice (2009), ""Bases de données pour l'étude d'un groupe de langues: l'exemple des langues slaves de l'Ouest"" , 8èmes Journées scientifiques du réseau LTT de l’AUF, Lisbonne (Portugal), octobre 2009, 15. Pognan Patrice (2009), ""Définition d'une base de données linguistiques ""à tout faire"" comprenant le français - comme langue pivot - et les langues slaves de l'Ouest"" , Congrès international Studia Romanistica Beliana, Banská Bystrica (Slovaquie), 16. Pognan Patrice (2009), ""Définition d’un prototype général de bases de données (étude des langues slaves de l’Ouest dans une visée multilingue)"" , Metalanguage and Encoding Scheme Design for Digital Lexicography – Innovative Solutions for Lexical Entry Design in Slavic Lexicography, MONDILEX Third Open Workshop, Académie des Sciences Slovaque, Bratislava (Slovaquie), 17. Provôt Agnès (2009), ""Le ""futur du passé"" en français et ses équivalents en allemand."" , 5e Rencontres de Sémantique et Pragmatique, Institut Supérieur des Langues de Gabès, Tunisie, 22-24 avril, 18. Stankovic Milan, Passant Alexandre et Laublet Philippe (2009), ""Directing Status Messages to their Audience in Online Communities"" , The MALLOW Workshop on Coordination, Organization, Institutions and Norms in agent systems in on-line communities (COIN2009), Torino, Italy, 09/2009, 19. Stankovic Milan, Passant Alexandre,and Laublet Philippe (2009), ""Status Messages for the Right Audience with an Ontology-Based Approach"" , In Proceedings of The First International Workshop On Collaborative Social Networks (CollaborateSN 2009). In conjuction with CollaborateCom 2009, Crystal City, Washington D.C., USA, November 11-14, 20. Taïfi Miloud, Pognan Patrice (2009), ""Traitements automatiques du « Dictionnaire raisonné berbère – français, Parlers du Maroc"" , 8èmes Journées scientifiques du réseau LTT de l’AUF, Lisbonne (Portugal), octobre 2009, 21. Taïfi Miloud, Pognan Patrice (2009), ""Vybudování databází na základ&#283; slovníku jako korpus (Construction d’une base de données à partir d’un dictionnaire en tant que corpus)"" , Congrès international Slovko 2009 (NLP, Corpus Linguistics), Smolenice / Bratislava (Slovaquie)"
publications,2009,Le Priol Florence,Lexique et Dictionnaire en musicologie : aspects informatiques," Invisibili Fili. Musica, Lessicografia, Editoria e Tecnologie dell'iInformazione, Ferrara, Italie, 28-30 mai 2009"
publications,2009,"Alrahabi Motasem, Desclés Jean-Pierre",EXCOM : Plate-forme d'annotation sémantique de textes multilingues," TALN 2009, Senlis, 24-26 juin"
publications,2009,Desclés Jean-Pierre,Introduction," Epistémologie des Sciences Humaines, Université Paris-Sorbonne, Maison de la Recherche, 17-19 décembre 2009, 2. Desclés Jean-Pierre (2009), ""Les sciences humaines ont-elles besoin de mathématiques ?"" , Epistémologie des Sciences Humaines, Université Paris-Sorbonne, Maison de la Recherche, 17-19 décembre 2009, 3. Desclés Jean-Pierre (2009), ""Conclusion"" , Epistémologie des Sciences Humaines, Université Paris-Sorbonne, Maison de la Recherche, 17-19 décembre 2009, 4. Pascu Anca (2009), ""Problèmes de catégorisations"" , Epistémologie des Sciences Humaines, Université Paris-Sorbonne, Maison de la Recherche, 17-19 décembre 2009"
publications,2010,"Desclés Jean-Pierre, Djioua Brahim, Le Priol Florence",Logique et langage : déduction naturelle," Hermann, [ ] 2. Guibert Gaëll (2010), ""Le ""dialogue"" Homme-Machine. Un qui-pro-quo ? "" , Eds. L'Harmattan, [ ] 3. Laublet Philippe (2010), Web Sémantique, Principes, représentations sémantiques et ontologies, ""Encyclopédie des techniques de l'ingénieur "" , 4. Passant Alexandre, Laublet Philippe, Breslin John and Decker Stefan (2010), ""Enhancing Enterprise 2.0 Ecosystems Using Semantic Web and Linked.- Data Technologies: The SemSLATES Approach "" , Eds. David Wood, Linking Enterprise Data. Springer"
publications,2010,"Passant Alexandre, Isaac Antoine, Laublet Philippe",Combining Linked Data and Knowledge Engineering Best Practices to Design a Lightweight Role," Special issue on Beautiful Ontology of Applied Ontology, à paraître, 2. Passant Alexandre, Laublet Philippe (2010), ""User-driven Generation of Semantic Web Content in Enterprise 2.0: A case-study"" , International Journal of Knowledge Engineering and Data Mining (IJKEDM), Special Issue on: “Incentives for Semantic Content Creation”, 3. Provôt Agnès, Desclés Jean-Pierre, Vinzerich Aude (2010), ""Invariant sémantique du présent de l’indicatif en français"" , Cahiers Chronos, vol. 21, 235-259 [ ]"
publications,2010,Alrahabi Motasem,Jean-Pierre Desclés,"sous la direction de Jean-Pierre Desclés , Université Paris-Sorbonne, 2010-01-29"
